{
  "$schema": "http://json-schema.org/draft-07/schema#",
  "$id": "https://raw.githubusercontent.com/wstein/flix-spec/main/schemas/projection.schema.json",
  "title": "Flix Projected Concrete Syntax Tree Schema",
  "description": "Schema for projected concrete syntax trees produced from Flix source files against the pinned oracle. A document is one of two forms of the same parse, and `form` says which: `raw` is the reference's own tree, node for node, and `normalized` is that tree with ast/transparency.json's rules applied. Both are committed -- fixtures/raw/ and fixtures/expected/ -- because they answer different questions, and a projected tree whose shape depends on an unstated normalisation is not comparable to anything.",
  "type": "object",
  "required": [
    "schemaVersion",
    "generatedBy",
    "toolVersion",
    "form",
    "upstreamCommit",
    "oracleSha256",
    "units"
  ],
  "properties": {
    "schemaVersion": {
      "type": "integer",
      "minimum": 2,
      "description": "2: `form` became required, because there are now two committed forms of every parse and an unlabelled one cannot be placed. A reader that gated on version 1 was reading documents that had no normalisation applied at all; failing loudly is the intended outcome."
    },
    "form": {
      "type": "string",
      "enum": ["raw", "normalized"],
      "description": "`raw` -- the producing parser's own tree, verbatim, with its wrappers and its error-recovery vocabulary intact. For the reference that is fixtures/raw/, the provenance record and the authority the recovery lane compares against; for a consumer it is the ordinary case, since the conformance comparison applies that consumer's declared transparency rules itself. `normalized` -- the canonical tree, with wrapper nodes elided and the error vocabulary spliced out per ast/transparency.json, which is what fixtures/expected/ holds and what a consumer is asked to agree with."
    },
    "generatedBy": {
      "type": "string",
      "minLength": 1,
      "description": "Fully qualified generator that produced this file."
    },
    "toolVersion": {
      "type": "string",
      "pattern": "^\\d+\\.\\d+\\.\\d+$",
      "description": "Generator version; bumped when the emitted format changes."
    },
    "upstreamCommit": {
      "type": "string",
      "pattern": "^[a-f0-9]{40}$",
      "description": "flix/flix commit this projection was derived from."
    },
    "oracleSha256": {
      "type": "string",
      "pattern": "^[a-f0-9]{64}$",
      "description": "SHA-256 of the oracle jar actually used."
    },
    "units": {
      "type": "array",
      "items": {
        "$ref": "#/definitions/CompilationUnit"
      }
    }
  },
  "additionalProperties": false,
  "definitions": {
    "CompilationUnit": {
      "type": "object",
      "required": [
        "source",
        "diagnostics",
        "tree"
      ],
      "properties": {
        "source": {
          "type": "string",
          "minLength": 1,
          "description": "Repository-relative, forward-slashed path. Never absolute: committed expectations must not be machine-specific."
        },
        "diagnostics": {
          "type": "array",
          "items": {
            "$ref": "#/definitions/Diagnostic"
          },
          "description": "Lexer and parser diagnostics, sorted by (line, col, kind)."
        },
        "tree": {
          "$ref": "#/definitions/Node"
        }
      },
      "additionalProperties": false
    },
    "Position": {
      "type": "object",
      "required": [
        "line",
        "col"
      ],
      "properties": {
        "line": {
          "type": "integer",
          "minimum": 1
        },
        "col": {
          "type": "integer",
          "minimum": 1
        }
      },
      "additionalProperties": false
    },
    "Span": {
      "type": "object",
      "required": [
        "start",
        "end"
      ],
      "properties": {
        "start": {
          "$ref": "#/definitions/Position"
        },
        "end": {
          "$ref": "#/definitions/Position"
        }
      },
      "additionalProperties": false
    },
    "TokenNode": {
      "type": "object",
      "required": [
        "token",
        "text",
        "start",
        "end"
      ],
      "properties": {
        "token": {
          "type": "string"
        },
        "text": {
          "type": "string"
        },
        "start": {
          "$ref": "#/definitions/Position"
        },
        "end": {
          "$ref": "#/definitions/Position"
        }
      },
      "additionalProperties": false
    },
    "Node": {
      "type": "object",
      "required": [
        "kind",
        "children"
      ],
      "properties": {
        "kind": {
          "type": "string",
          "minLength": 1,
          "description": "Sub-trait-qualified TreeKind name drawn from ast/treekind.json, e.g. Expr.Apply. Bare names are ambiguous: 14 simple names are reused across sub-traits, and 30 qualified kinds collapse onto them."
        },
        "span": {
          "$ref": "#/definitions/Span"
        },
        "children": {
          "type": "array",
          "items": {
            "oneOf": [
              {
                "$ref": "#/definitions/Node"
              },
              {
                "$ref": "#/definitions/TokenNode"
              }
            ]
          }
        }
      },
      "additionalProperties": false
    },
    "Diagnostic": {
      "type": "object",
      "description": "kind and line are gated by conformance; col and message are advisory because both are recovery-dependent (implementation plan section 3.4).",
      "required": [
        "kind",
        "line",
        "col",
        "message"
      ],
      "properties": {
        "kind": {
          "type": "string",
          "minLength": 1
        },
        "line": {
          "type": "integer",
          "minimum": 0
        },
        "col": {
          "type": "integer",
          "minimum": 0
        },
        "message": {
          "type": "string"
        }
      },
      "additionalProperties": false
    }
  }
}
