{
  "schemaVersion": 2,
  "generatedBy": "flix.spec.ProjectionExtractor",
  "toolVersion": "2.0.0",
  "form": "normalized",
  "upstreamCommit": "f2d4678c20bff1242f4cad5e23144db91027b762",
  "oracleSha256": "d8d9a3870e199c03ed6364ea9430f56f67bfd38c332c411628a6a7cb88b2b0b4",
  "units": [
    {
      "source": "fixtures/positive/lexical__numeric-literals.flix",
      "diagnostics": [],
      "tree": {"kind":"Root","span":{"start":{"line":1,"col":1},"end":{"line":2,"col":1}},"children":[{"kind":"Decl.Def","span":{"start":{"line":1,"col":1},"end":{"line":1,"col":99}},"children":[{"token":"KeywordDef","text":"def","start":{"line":1,"col":1},"end":{"line":1,"col":4}},{"kind":"Ident","span":{"start":{"line":1,"col":5},"end":{"line":1,"col":6}},"children":[{"token":"NameLowercase","text":"f","start":{"line":1,"col":5},"end":{"line":1,"col":6}}]},{"kind":"ParameterList","span":{"start":{"line":1,"col":6},"end":{"line":1,"col":8}},"children":[{"token":"ParenL","text":"(","start":{"line":1,"col":6},"end":{"line":1,"col":7}},{"token":"ParenR","text":")","start":{"line":1,"col":7},"end":{"line":1,"col":8}}]},{"token":"Colon","text":":","start":{"line":1,"col":8},"end":{"line":1,"col":9}},{"kind":"Ident","span":{"start":{"line":1,"col":10},"end":{"line":1,"col":14}},"children":[{"token":"NameUppercase","text":"Unit","start":{"line":1,"col":10},"end":{"line":1,"col":14}}]},{"token":"Equal","text":"=","start":{"line":1,"col":15},"end":{"line":1,"col":16}},{"kind":"Expr.Tuple","span":{"start":{"line":1,"col":17},"end":{"line":1,"col":99}},"children":[{"token":"ParenL","text":"(","start":{"line":1,"col":17},"end":{"line":1,"col":18}},{"kind":"Expr.Literal","span":{"start":{"line":1,"col":18},"end":{"line":1,"col":19}},"children":[{"token":"LiteralInt","text":"1","start":{"line":1,"col":18},"end":{"line":1,"col":19}}]},{"token":"Comma","text":",","start":{"line":1,"col":19},"end":{"line":1,"col":20}},{"kind":"Expr.Literal","span":{"start":{"line":1,"col":21},"end":{"line":1,"col":30}},"children":[{"token":"LiteralInt","text":"1_000_000","start":{"line":1,"col":21},"end":{"line":1,"col":30}}]},{"token":"Comma","text":",","start":{"line":1,"col":30},"end":{"line":1,"col":31}},{"kind":"Expr.Literal","span":{"start":{"line":1,"col":32},"end":{"line":1,"col":36}},"children":[{"token":"LiteralInt","text":"0xFF","start":{"line":1,"col":32},"end":{"line":1,"col":36}}]},{"token":"Comma","text":",","start":{"line":1,"col":36},"end":{"line":1,"col":37}},{"kind":"Expr.Literal","span":{"start":{"line":1,"col":38},"end":{"line":1,"col":42}},"children":[{"token":"LiteralInt8","text":"42i8","start":{"line":1,"col":38},"end":{"line":1,"col":42}}]},{"token":"Comma","text":",","start":{"line":1,"col":42},"end":{"line":1,"col":43}},{"kind":"Expr.Literal","span":{"start":{"line":1,"col":44},"end":{"line":1,"col":48}},"children":[{"token":"LiteralInt16","text":"5i16","start":{"line":1,"col":44},"end":{"line":1,"col":48}}]},{"token":"Comma","text":",","start":{"line":1,"col":48},"end":{"line":1,"col":49}},{"kind":"Expr.Literal","span":{"start":{"line":1,"col":50},"end":{"line":1,"col":54}},"children":[{"token":"LiteralInt32","text":"6i32","start":{"line":1,"col":50},"end":{"line":1,"col":54}}]},{"token":"Comma","text":",","start":{"line":1,"col":54},"end":{"line":1,"col":55}},{"kind":"Expr.Literal","span":{"start":{"line":1,"col":56},"end":{"line":1,"col":60}},"children":[{"token":"LiteralInt64","text":"7i64","start":{"line":1,"col":56},"end":{"line":1,"col":60}}]},{"token":"Comma","text":",","start":{"line":1,"col":60},"end":{"line":1,"col":61}},{"kind":"Expr.Literal","span":{"start":{"line":1,"col":62},"end":{"line":1,"col":65}},"children":[{"token":"LiteralBigInt","text":"7ii","start":{"line":1,"col":62},"end":{"line":1,"col":65}}]},{"token":"Comma","text":",","start":{"line":1,"col":65},"end":{"line":1,"col":66}},{"kind":"Expr.Literal","span":{"start":{"line":1,"col":67},"end":{"line":1,"col":70}},"children":[{"token":"LiteralFloat","text":"1.5","start":{"line":1,"col":67},"end":{"line":1,"col":70}}]},{"token":"Comma","text":",","start":{"line":1,"col":70},"end":{"line":1,"col":71}},{"kind":"Expr.Literal","span":{"start":{"line":1,"col":72},"end":{"line":1,"col":78}},"children":[{"token":"LiteralFloat32","text":"1.5f32","start":{"line":1,"col":72},"end":{"line":1,"col":78}}]},{"token":"Comma","text":",","start":{"line":1,"col":78},"end":{"line":1,"col":79}},{"kind":"Expr.Literal","span":{"start":{"line":1,"col":80},"end":{"line":1,"col":85}},"children":[{"token":"LiteralBigDecimal","text":"2.0ff","start":{"line":1,"col":80},"end":{"line":1,"col":85}}]},{"token":"Comma","text":",","start":{"line":1,"col":85},"end":{"line":1,"col":86}},{"kind":"Expr.Literal","span":{"start":{"line":1,"col":87},"end":{"line":1,"col":93}},"children":[{"token":"LiteralFloat64","text":"8.0f64","start":{"line":1,"col":87},"end":{"line":1,"col":93}}]},{"token":"Comma","text":",","start":{"line":1,"col":93},"end":{"line":1,"col":94}},{"kind":"Expr.Literal","span":{"start":{"line":1,"col":95},"end":{"line":1,"col":98}},"children":[{"token":"LiteralFloat","text":"1e5","start":{"line":1,"col":95},"end":{"line":1,"col":98}}]},{"token":"ParenR","text":")","start":{"line":1,"col":98},"end":{"line":1,"col":99}}]}]}]}
    }
  ]
}
