{
  "schemaVersion": 2,
  "generatedBy": "flix.spec.ProjectionExtractor",
  "toolVersion": "2.0.0",
  "form": "normalized",
  "upstreamCommit": "f2d4678c20bff1242f4cad5e23144db91027b762",
  "oracleSha256": "d8d9a3870e199c03ed6364ea9430f56f67bfd38c332c411628a6a7cb88b2b0b4",
  "units": [
    {
      "source": "fixtures/negative/lexical__unterminated-string-interpolation.flix",
      "diagnostics": [
      {"kind":"UnterminatedStringInterpolation","line":1,"col":19,"message":"UnterminatedStringInterpolation(fixtures/negative/lexical__unterminated-string-interpolation.flix:1:19)"}
    ],
      "tree": {"kind":"Root","span":{"start":{"line":1,"col":1},"end":{"line":2,"col":1}},"children":[{"kind":"Decl.Def","span":{"start":{"line":1,"col":1},"end":{"line":1,"col":21}},"children":[{"token":"KeywordDef","text":"def","start":{"line":1,"col":1},"end":{"line":1,"col":4}},{"kind":"Ident","span":{"start":{"line":1,"col":5},"end":{"line":1,"col":6}},"children":[{"token":"NameLowercase","text":"f","start":{"line":1,"col":5},"end":{"line":1,"col":6}}]},{"kind":"ParameterList","span":{"start":{"line":1,"col":6},"end":{"line":1,"col":8}},"children":[{"token":"ParenL","text":"(","start":{"line":1,"col":6},"end":{"line":1,"col":7}},{"token":"ParenR","text":")","start":{"line":1,"col":7},"end":{"line":1,"col":8}}]},{"token":"Colon","text":":","start":{"line":1,"col":8},"end":{"line":1,"col":9}},{"kind":"Ident","span":{"start":{"line":1,"col":10},"end":{"line":1,"col":14}},"children":[{"token":"NameUppercase","text":"Unit","start":{"line":1,"col":10},"end":{"line":1,"col":14}}]},{"token":"Equal","text":"=","start":{"line":1,"col":15},"end":{"line":1,"col":16}},{"kind":"Expr.StringInterpolation","span":{"start":{"line":1,"col":17},"end":{"line":1,"col":21}},"children":[{"token":"LiteralStringInterpolationL","text":"\"${","start":{"line":1,"col":17},"end":{"line":1,"col":20}},{"kind":"Ident","span":{"start":{"line":1,"col":20},"end":{"line":1,"col":21}},"children":[{"token":"NameLowercase","text":"x","start":{"line":1,"col":20},"end":{"line":1,"col":21}}]}]}]},{"token":"Err","text":"\n","start":{"line":1,"col":21},"end":{"line":1,"col":22}}]}
    }
  ]
}
