{
  "schemaVersion": 2,
  "generatedBy": "flix.spec.ProjectionExtractor",
  "toolVersion": "2.0.0",
  "form": "raw",
  "upstreamCommit": "4a5b60a31ac03bb762f68b554a0fc2b6f4d982b9",
  "oracleSha256": "20007d79f97b696ba388113e2a4235227691d33a00bfa669f2316b37a7b14201",
  "units": [
    {
      "source": "fixtures/positive/expressions__operator-precedence.flix",
      "diagnostics": [],
      "tree": {"kind":"Root","span":{"start":{"line":1,"col":1},"end":{"line":2,"col":1}},"children":[{"kind":"UsesOrImports.UseOrImportList","span":{"start":{"line":1,"col":1},"end":{"line":1,"col":1}},"children":[]},{"kind":"Decl.Def","span":{"start":{"line":1,"col":1},"end":{"line":1,"col":55}},"children":[{"kind":"Doc","span":{"start":{"line":1,"col":1},"end":{"line":1,"col":1}},"children":[]},{"kind":"AnnotationList","span":{"start":{"line":1,"col":1},"end":{"line":1,"col":1}},"children":[]},{"kind":"ModifierList","span":{"start":{"line":1,"col":1},"end":{"line":1,"col":1}},"children":[]},{"token":"KeywordDef","text":"def","start":{"line":1,"col":1},"end":{"line":1,"col":4}},{"kind":"Ident","span":{"start":{"line":1,"col":5},"end":{"line":1,"col":6}},"children":[{"token":"NameLowercase","text":"f","start":{"line":1,"col":5},"end":{"line":1,"col":6}}]},{"kind":"ParameterList","span":{"start":{"line":1,"col":6},"end":{"line":1,"col":8}},"children":[{"token":"ParenL","text":"(","start":{"line":1,"col":6},"end":{"line":1,"col":7}},{"token":"ParenR","text":")","start":{"line":1,"col":7},"end":{"line":1,"col":8}}]},{"token":"Colon","text":":","start":{"line":1,"col":8},"end":{"line":1,"col":9}},{"kind":"Type.Type","span":{"start":{"line":1,"col":10},"end":{"line":1,"col":14}},"children":[{"kind":"QName","span":{"start":{"line":1,"col":10},"end":{"line":1,"col":14}},"children":[{"kind":"Ident","span":{"start":{"line":1,"col":10},"end":{"line":1,"col":14}},"children":[{"token":"NameUppercase","text":"Unit","start":{"line":1,"col":10},"end":{"line":1,"col":14}}]}]}]},{"token":"Equal","text":"=","start":{"line":1,"col":15},"end":{"line":1,"col":16}},{"kind":"Expr.Expr","span":{"start":{"line":1,"col":17},"end":{"line":1,"col":55}},"children":[{"kind":"Expr.Binary","span":{"start":{"line":1,"col":17},"end":{"line":1,"col":55}},"children":[{"kind":"Expr.Expr","span":{"start":{"line":1,"col":17},"end":{"line":1,"col":28}},"children":[{"kind":"Expr.Binary","span":{"start":{"line":1,"col":17},"end":{"line":1,"col":28}},"children":[{"kind":"Expr.Expr","span":{"start":{"line":1,"col":17},"end":{"line":1,"col":22}},"children":[{"kind":"Expr.Unary","span":{"start":{"line":1,"col":17},"end":{"line":1,"col":22}},"children":[{"kind":"Operator","span":{"start":{"line":1,"col":17},"end":{"line":1,"col":20}},"children":[{"token":"KeywordNot","text":"not","start":{"line":1,"col":17},"end":{"line":1,"col":20}}]},{"kind":"Expr.Expr","span":{"start":{"line":1,"col":21},"end":{"line":1,"col":22}},"children":[{"kind":"QName","span":{"start":{"line":1,"col":21},"end":{"line":1,"col":22}},"children":[{"kind":"Ident","span":{"start":{"line":1,"col":21},"end":{"line":1,"col":22}},"children":[{"token":"NameLowercase","text":"a","start":{"line":1,"col":21},"end":{"line":1,"col":22}}]}]}]}]}]},{"kind":"Operator","span":{"start":{"line":1,"col":23},"end":{"line":1,"col":26}},"children":[{"token":"KeywordAnd","text":"and","start":{"line":1,"col":23},"end":{"line":1,"col":26}}]},{"kind":"Expr.Expr","span":{"start":{"line":1,"col":27},"end":{"line":1,"col":28}},"children":[{"kind":"QName","span":{"start":{"line":1,"col":27},"end":{"line":1,"col":28}},"children":[{"kind":"Ident","span":{"start":{"line":1,"col":27},"end":{"line":1,"col":28}},"children":[{"token":"NameLowercase","text":"b","start":{"line":1,"col":27},"end":{"line":1,"col":28}}]}]}]}]}]},{"kind":"Operator","span":{"start":{"line":1,"col":29},"end":{"line":1,"col":31}},"children":[{"token":"KeywordOr","text":"or","start":{"line":1,"col":29},"end":{"line":1,"col":31}}]},{"kind":"Expr.Expr","span":{"start":{"line":1,"col":32},"end":{"line":1,"col":55}},"children":[{"kind":"Expr.Binary","span":{"start":{"line":1,"col":32},"end":{"line":1,"col":55}},"children":[{"kind":"Expr.Expr","span":{"start":{"line":1,"col":32},"end":{"line":1,"col":33}},"children":[{"kind":"QName","span":{"start":{"line":1,"col":32},"end":{"line":1,"col":33}},"children":[{"kind":"Ident","span":{"start":{"line":1,"col":32},"end":{"line":1,"col":33}},"children":[{"token":"NameLowercase","text":"c","start":{"line":1,"col":32},"end":{"line":1,"col":33}}]}]}]},{"kind":"Operator","span":{"start":{"line":1,"col":34},"end":{"line":1,"col":36}},"children":[{"token":"EqualEqual","text":"==","start":{"line":1,"col":34},"end":{"line":1,"col":36}}]},{"kind":"Expr.Expr","span":{"start":{"line":1,"col":37},"end":{"line":1,"col":55}},"children":[{"kind":"Expr.Binary","span":{"start":{"line":1,"col":37},"end":{"line":1,"col":55}},"children":[{"kind":"Expr.Expr","span":{"start":{"line":1,"col":37},"end":{"line":1,"col":38}},"children":[{"kind":"QName","span":{"start":{"line":1,"col":37},"end":{"line":1,"col":38}},"children":[{"kind":"Ident","span":{"start":{"line":1,"col":37},"end":{"line":1,"col":38}},"children":[{"token":"NameLowercase","text":"d","start":{"line":1,"col":37},"end":{"line":1,"col":38}}]}]}]},{"kind":"Operator","span":{"start":{"line":1,"col":39},"end":{"line":1,"col":40}},"children":[{"token":"AngleL","text":"<","start":{"line":1,"col":39},"end":{"line":1,"col":40}}]},{"kind":"Expr.Expr","span":{"start":{"line":1,"col":41},"end":{"line":1,"col":55}},"children":[{"kind":"Expr.Binary","span":{"start":{"line":1,"col":41},"end":{"line":1,"col":55}},"children":[{"kind":"Expr.Expr","span":{"start":{"line":1,"col":41},"end":{"line":1,"col":42}},"children":[{"kind":"QName","span":{"start":{"line":1,"col":41},"end":{"line":1,"col":42}},"children":[{"kind":"Ident","span":{"start":{"line":1,"col":41},"end":{"line":1,"col":42}},"children":[{"token":"NameLowercase","text":"e","start":{"line":1,"col":41},"end":{"line":1,"col":42}}]}]}]},{"kind":"Operator","span":{"start":{"line":1,"col":43},"end":{"line":1,"col":45}},"children":[{"token":"ColonColon","text":"::","start":{"line":1,"col":43},"end":{"line":1,"col":45}}]},{"kind":"Expr.Expr","span":{"start":{"line":1,"col":46},"end":{"line":1,"col":55}},"children":[{"kind":"Expr.Binary","span":{"start":{"line":1,"col":46},"end":{"line":1,"col":55}},"children":[{"kind":"Expr.Expr","span":{"start":{"line":1,"col":46},"end":{"line":1,"col":47}},"children":[{"kind":"QName","span":{"start":{"line":1,"col":46},"end":{"line":1,"col":47}},"children":[{"kind":"Ident","span":{"start":{"line":1,"col":46},"end":{"line":1,"col":47}},"children":[{"token":"NameLowercase","text":"g","start":{"line":1,"col":46},"end":{"line":1,"col":47}}]}]}]},{"kind":"Operator","span":{"start":{"line":1,"col":48},"end":{"line":1,"col":49}},"children":[{"token":"Plus","text":"+","start":{"line":1,"col":48},"end":{"line":1,"col":49}}]},{"kind":"Expr.Expr","span":{"start":{"line":1,"col":50},"end":{"line":1,"col":55}},"children":[{"kind":"Expr.Binary","span":{"start":{"line":1,"col":50},"end":{"line":1,"col":55}},"children":[{"kind":"Expr.Expr","span":{"start":{"line":1,"col":50},"end":{"line":1,"col":51}},"children":[{"kind":"QName","span":{"start":{"line":1,"col":50},"end":{"line":1,"col":51}},"children":[{"kind":"Ident","span":{"start":{"line":1,"col":50},"end":{"line":1,"col":51}},"children":[{"token":"NameLowercase","text":"h","start":{"line":1,"col":50},"end":{"line":1,"col":51}}]}]}]},{"kind":"Operator","span":{"start":{"line":1,"col":52},"end":{"line":1,"col":53}},"children":[{"token":"Star","text":"*","start":{"line":1,"col":52},"end":{"line":1,"col":53}}]},{"kind":"Expr.Expr","span":{"start":{"line":1,"col":54},"end":{"line":1,"col":55}},"children":[{"kind":"QName","span":{"start":{"line":1,"col":54},"end":{"line":1,"col":55}},"children":[{"kind":"Ident","span":{"start":{"line":1,"col":54},"end":{"line":1,"col":55}},"children":[{"token":"NameLowercase","text":"i","start":{"line":1,"col":54},"end":{"line":1,"col":55}}]}]}]}]}]}]}]}]}]}]}]}]}]}]}]}]}]}
    }
  ]
}
