{
  "schemaVersion": 2,
  "generatedBy": "flix.spec.ProjectionExtractor",
  "toolVersion": "2.0.0",
  "form": "normalized",
  "upstreamCommit": "4a5b60a31ac03bb762f68b554a0fc2b6f4d982b9",
  "oracleSha256": "20007d79f97b696ba388113e2a4235227691d33a00bfa669f2316b37a7b14201",
  "units": [
    {
      "source": "fixtures/positive/declarations__restrictable-enum.flix",
      "diagnostics": [],
      "tree": {"kind":"Root","span":{"start":{"line":1,"col":1},"end":{"line":5,"col":1}},"children":[{"kind":"Decl.RestrictableEnum","span":{"start":{"line":1,"col":1},"end":{"line":4,"col":2}},"children":[{"token":"KeywordRestrictable","text":"restrictable","start":{"line":1,"col":1},"end":{"line":1,"col":13}},{"token":"KeywordEnum","text":"enum","start":{"line":1,"col":14},"end":{"line":1,"col":18}},{"kind":"Ident","span":{"start":{"line":1,"col":19},"end":{"line":1,"col":23}},"children":[{"token":"NameUppercase","text":"Expr","start":{"line":1,"col":19},"end":{"line":1,"col":23}}]},{"token":"BracketL","text":"[","start":{"line":1,"col":23},"end":{"line":1,"col":24}},{"kind":"Parameter","span":{"start":{"line":1,"col":24},"end":{"line":1,"col":25}},"children":[{"kind":"Ident","span":{"start":{"line":1,"col":24},"end":{"line":1,"col":25}},"children":[{"token":"NameLowercase","text":"s","start":{"line":1,"col":24},"end":{"line":1,"col":25}}]}]},{"token":"BracketR","text":"]","start":{"line":1,"col":25},"end":{"line":1,"col":26}},{"kind":"TypeParameterList","span":{"start":{"line":1,"col":26},"end":{"line":1,"col":29}},"children":[{"token":"BracketL","text":"[","start":{"line":1,"col":26},"end":{"line":1,"col":27}},{"kind":"Parameter","span":{"start":{"line":1,"col":27},"end":{"line":1,"col":28}},"children":[{"kind":"Ident","span":{"start":{"line":1,"col":27},"end":{"line":1,"col":28}},"children":[{"token":"NameLowercase","text":"a","start":{"line":1,"col":27},"end":{"line":1,"col":28}}]}]},{"token":"BracketR","text":"]","start":{"line":1,"col":28},"end":{"line":1,"col":29}}]},{"token":"CurlyL","text":"{","start":{"line":1,"col":30},"end":{"line":1,"col":31}},{"kind":"Case","span":{"start":{"line":2,"col":5},"end":{"line":2,"col":16}},"children":[{"token":"KeywordCase","text":"case","start":{"line":2,"col":5},"end":{"line":2,"col":9}},{"kind":"Ident","span":{"start":{"line":2,"col":10},"end":{"line":2,"col":13}},"children":[{"token":"NameUppercase","text":"Cst","start":{"line":2,"col":10},"end":{"line":2,"col":13}}]},{"kind":"CaseBody","span":{"start":{"line":2,"col":13},"end":{"line":2,"col":16}},"children":[{"token":"ParenL","text":"(","start":{"line":2,"col":13},"end":{"line":2,"col":14}},{"kind":"Type.Variable","span":{"start":{"line":2,"col":14},"end":{"line":2,"col":15}},"children":[{"token":"NameLowercase","text":"a","start":{"line":2,"col":14},"end":{"line":2,"col":15}}]},{"token":"ParenR","text":")","start":{"line":2,"col":15},"end":{"line":2,"col":16}}]}]},{"kind":"Case","span":{"start":{"line":3,"col":5},"end":{"line":3,"col":20}},"children":[{"token":"KeywordCase","text":"case","start":{"line":3,"col":5},"end":{"line":3,"col":9}},{"kind":"Ident","span":{"start":{"line":3,"col":10},"end":{"line":3,"col":13}},"children":[{"token":"NameUppercase","text":"Var","start":{"line":3,"col":10},"end":{"line":3,"col":13}}]},{"kind":"CaseBody","span":{"start":{"line":3,"col":13},"end":{"line":3,"col":20}},"children":[{"token":"ParenL","text":"(","start":{"line":3,"col":13},"end":{"line":3,"col":14}},{"kind":"Ident","span":{"start":{"line":3,"col":14},"end":{"line":3,"col":19}},"children":[{"token":"NameUppercase","text":"Int32","start":{"line":3,"col":14},"end":{"line":3,"col":19}}]},{"token":"ParenR","text":")","start":{"line":3,"col":19},"end":{"line":3,"col":20}}]}]},{"token":"CurlyR","text":"}","start":{"line":4,"col":1},"end":{"line":4,"col":2}}]}]}
    }
  ]
}
