{
  "schemaVersion": 2,
  "generatedBy": "flix.spec.ProjectionExtractor",
  "toolVersion": "2.0.0",
  "form": "normalized",
  "upstreamCommit": "4a5b60a31ac03bb762f68b554a0fc2b6f4d982b9",
  "oracleSha256": "20007d79f97b696ba388113e2a4235227691d33a00bfa669f2316b37a7b14201",
  "units": [
    {
      "source": "fixtures/positive/types__record-row-and-schema-row-types.flix",
      "diagnostics": [],
      "tree": {"kind":"Root","span":{"start":{"line":1,"col":1},"end":{"line":2,"col":1}},"children":[{"kind":"Decl.Def","span":{"start":{"line":1,"col":1},"end":{"line":1,"col":33}},"children":[{"token":"KeywordDef","text":"def","start":{"line":1,"col":1},"end":{"line":1,"col":4}},{"kind":"Ident","span":{"start":{"line":1,"col":5},"end":{"line":1,"col":6}},"children":[{"token":"NameLowercase","text":"f","start":{"line":1,"col":5},"end":{"line":1,"col":6}}]},{"kind":"ParameterList","span":{"start":{"line":1,"col":6},"end":{"line":1,"col":8}},"children":[{"token":"ParenL","text":"(","start":{"line":1,"col":6},"end":{"line":1,"col":7}},{"token":"ParenR","text":")","start":{"line":1,"col":7},"end":{"line":1,"col":8}}]},{"token":"Colon","text":":","start":{"line":1,"col":8},"end":{"line":1,"col":9}},{"kind":"Type.Tuple","span":{"start":{"line":1,"col":10},"end":{"line":1,"col":27}},"children":[{"token":"ParenL","text":"(","start":{"line":1,"col":10},"end":{"line":1,"col":11}},{"kind":"Type.RecordRow","span":{"start":{"line":1,"col":11},"end":{"line":1,"col":26}},"children":[{"token":"ParenL","text":"(","start":{"line":1,"col":11},"end":{"line":1,"col":12}},{"kind":"Type.RecordFieldFragment","span":{"start":{"line":1,"col":12},"end":{"line":1,"col":21}},"children":[{"kind":"Ident","span":{"start":{"line":1,"col":12},"end":{"line":1,"col":13}},"children":[{"token":"NameLowercase","text":"x","start":{"line":1,"col":12},"end":{"line":1,"col":13}}]},{"token":"Equal","text":"=","start":{"line":1,"col":14},"end":{"line":1,"col":15}},{"kind":"Ident","span":{"start":{"line":1,"col":16},"end":{"line":1,"col":21}},"children":[{"token":"NameUppercase","text":"Int32","start":{"line":1,"col":16},"end":{"line":1,"col":21}}]}]},{"token":"Bar","text":"|","start":{"line":1,"col":22},"end":{"line":1,"col":23}},{"kind":"Type.Variable","span":{"start":{"line":1,"col":24},"end":{"line":1,"col":25}},"children":[{"token":"NameLowercase","text":"r","start":{"line":1,"col":24},"end":{"line":1,"col":25}}]},{"token":"ParenR","text":")","start":{"line":1,"col":25},"end":{"line":1,"col":26}}]},{"token":"ParenR","text":")","start":{"line":1,"col":26},"end":{"line":1,"col":27}}]},{"token":"Equal","text":"=","start":{"line":1,"col":28},"end":{"line":1,"col":29}},{"kind":"Expr.Hole","span":{"start":{"line":1,"col":30},"end":{"line":1,"col":33}},"children":[{"token":"HoleAnonymous","text":"???","start":{"line":1,"col":30},"end":{"line":1,"col":33}}]}]}]}
    }
  ]
}
