{
  "schemaVersion": 2,
  "generatedBy": "flix.spec.ProjectionExtractor",
  "toolVersion": "2.0.0",
  "form": "normalized",
  "upstreamCommit": "f2d4678c20bff1242f4cad5e23144db91027b762",
  "oracleSha256": "d8d9a3870e199c03ed6364ea9430f56f67bfd38c332c411628a6a7cb88b2b0b4",
  "units": [
    {
      "source": "fixtures/negative/expressions__anonymous-class-with-methods-and-a-constructor.flix",
      "diagnostics": [
      {"kind":"UnexpectedToken","line":3,"col":9,"message":"UnexpectedToken(FromKinds(Set(NameLowercase, NameUppercase)),Some(KeywordRun),OtherExpr,Some('run' is a keyword.),fixtures/negative/expressions__anonymous-class-with-methods-and-a-constructor.flix:3:9)"}
    ],
      "tree": {"kind":"Root","span":{"start":{"line":1,"col":1},"end":{"line":5,"col":1}},"children":[{"kind":"Decl.Def","span":{"start":{"line":1,"col":1},"end":{"line":4,"col":2}},"children":[{"token":"KeywordDef","text":"def","start":{"line":1,"col":1},"end":{"line":1,"col":4}},{"kind":"Ident","span":{"start":{"line":1,"col":5},"end":{"line":1,"col":6}},"children":[{"token":"NameLowercase","text":"f","start":{"line":1,"col":5},"end":{"line":1,"col":6}}]},{"kind":"ParameterList","span":{"start":{"line":1,"col":6},"end":{"line":1,"col":8}},"children":[{"token":"ParenL","text":"(","start":{"line":1,"col":6},"end":{"line":1,"col":7}},{"token":"ParenR","text":")","start":{"line":1,"col":7},"end":{"line":1,"col":8}}]},{"token":"Colon","text":":","start":{"line":1,"col":8},"end":{"line":1,"col":9}},{"kind":"Ident","span":{"start":{"line":1,"col":10},"end":{"line":1,"col":14}},"children":[{"token":"NameUppercase","text":"Unit","start":{"line":1,"col":10},"end":{"line":1,"col":14}}]},{"token":"Equal","text":"=","start":{"line":1,"col":15},"end":{"line":1,"col":16}},{"kind":"Expr.AmbiguousNew","span":{"start":{"line":1,"col":17},"end":{"line":4,"col":2}},"children":[{"token":"KeywordNew","text":"new","start":{"line":1,"col":17},"end":{"line":1,"col":20}},{"kind":"Ident","span":{"start":{"line":1,"col":21},"end":{"line":1,"col":29}},"children":[{"token":"NameUppercase","text":"Runnable","start":{"line":1,"col":21},"end":{"line":1,"col":29}}]},{"token":"CurlyL","text":"{","start":{"line":1,"col":30},"end":{"line":1,"col":31}},{"kind":"Expr.JvmConstructor","span":{"start":{"line":2,"col":5},"end":{"line":2,"col":30}},"children":[{"token":"KeywordDef","text":"def","start":{"line":2,"col":5},"end":{"line":2,"col":8}},{"token":"KeywordNew","text":"new","start":{"line":2,"col":9},"end":{"line":2,"col":12}},{"token":"ParenL","text":"(","start":{"line":2,"col":12},"end":{"line":2,"col":13}},{"token":"ParenR","text":")","start":{"line":2,"col":13},"end":{"line":2,"col":14}},{"token":"Colon","text":":","start":{"line":2,"col":14},"end":{"line":2,"col":15}},{"kind":"Ident","span":{"start":{"line":2,"col":16},"end":{"line":2,"col":24}},"children":[{"token":"NameUppercase","text":"Runnable","start":{"line":2,"col":16},"end":{"line":2,"col":24}}]},{"token":"Equal","text":"=","start":{"line":2,"col":25},"end":{"line":2,"col":26}},{"kind":"Expr.Hole","span":{"start":{"line":2,"col":27},"end":{"line":2,"col":30}},"children":[{"token":"HoleAnonymous","text":"???","start":{"line":2,"col":27},"end":{"line":2,"col":30}}]}]},{"kind":"Expr.JvmMethod","span":{"start":{"line":3,"col":5},"end":{"line":3,"col":40}},"children":[{"token":"KeywordDef","text":"def","start":{"line":3,"col":5},"end":{"line":3,"col":8}},{"token":"KeywordRun","text":"run","start":{"line":3,"col":9},"end":{"line":3,"col":12}},{"kind":"ParameterList","span":{"start":{"line":3,"col":12},"end":{"line":3,"col":14}},"children":[{"token":"ParenL","text":"(","start":{"line":3,"col":12},"end":{"line":3,"col":13}},{"token":"ParenR","text":")","start":{"line":3,"col":13},"end":{"line":3,"col":14}}]},{"token":"Colon","text":":","start":{"line":3,"col":14},"end":{"line":3,"col":15}},{"kind":"Ident","span":{"start":{"line":3,"col":16},"end":{"line":3,"col":20}},"children":[{"token":"NameUppercase","text":"Unit","start":{"line":3,"col":16},"end":{"line":3,"col":20}}]},{"token":"Backslash","text":"\\","start":{"line":3,"col":21},"end":{"line":3,"col":22}},{"kind":"Ident","span":{"start":{"line":3,"col":23},"end":{"line":3,"col":25}},"children":[{"token":"NameUppercase","text":"IO","start":{"line":3,"col":23},"end":{"line":3,"col":25}}]},{"token":"Equal","text":"=","start":{"line":3,"col":26},"end":{"line":3,"col":27}},{"kind":"Expr.Apply","span":{"start":{"line":3,"col":28},"end":{"line":3,"col":40}},"children":[{"kind":"Ident","span":{"start":{"line":3,"col":28},"end":{"line":3,"col":35}},"children":[{"token":"NameLowercase","text":"println","start":{"line":3,"col":28},"end":{"line":3,"col":35}}]},{"kind":"ArgumentList","span":{"start":{"line":3,"col":35},"end":{"line":3,"col":40}},"children":[{"token":"ParenL","text":"(","start":{"line":3,"col":35},"end":{"line":3,"col":36}},{"kind":"Expr.Literal","span":{"start":{"line":3,"col":36},"end":{"line":3,"col":39}},"children":[{"token":"LiteralString","text":"\"x\"","start":{"line":3,"col":36},"end":{"line":3,"col":39}}]},{"token":"ParenR","text":")","start":{"line":3,"col":39},"end":{"line":3,"col":40}}]}]}]},{"token":"CurlyR","text":"}","start":{"line":4,"col":1},"end":{"line":4,"col":2}}]}]}]}
    }
  ]
}
