{
  "schemaVersion": 2,
  "generatedBy": "flix.spec.ProjectionExtractor",
  "toolVersion": "2.0.0",
  "form": "raw",
  "upstreamCommit": "4a5b60a31ac03bb762f68b554a0fc2b6f4d982b9",
  "oracleSha256": "20007d79f97b696ba388113e2a4235227691d33a00bfa669f2316b37a7b14201",
  "units": [
    {
      "source": "fixtures/positive/types__tuple-and-unit-types.flix",
      "diagnostics": [],
      "tree": {"kind":"Root","span":{"start":{"line":1,"col":1},"end":{"line":2,"col":1}},"children":[{"kind":"UsesOrImports.UseOrImportList","span":{"start":{"line":1,"col":1},"end":{"line":1,"col":1}},"children":[]},{"kind":"Decl.Def","span":{"start":{"line":1,"col":1},"end":{"line":1,"col":31}},"children":[{"kind":"Doc","span":{"start":{"line":1,"col":1},"end":{"line":1,"col":1}},"children":[]},{"kind":"AnnotationList","span":{"start":{"line":1,"col":1},"end":{"line":1,"col":1}},"children":[]},{"kind":"ModifierList","span":{"start":{"line":1,"col":1},"end":{"line":1,"col":1}},"children":[]},{"token":"KeywordDef","text":"def","start":{"line":1,"col":1},"end":{"line":1,"col":4}},{"kind":"Ident","span":{"start":{"line":1,"col":5},"end":{"line":1,"col":6}},"children":[{"token":"NameLowercase","text":"f","start":{"line":1,"col":5},"end":{"line":1,"col":6}}]},{"kind":"ParameterList","span":{"start":{"line":1,"col":6},"end":{"line":1,"col":8}},"children":[{"token":"ParenL","text":"(","start":{"line":1,"col":6},"end":{"line":1,"col":7}},{"token":"ParenR","text":")","start":{"line":1,"col":7},"end":{"line":1,"col":8}}]},{"token":"Colon","text":":","start":{"line":1,"col":8},"end":{"line":1,"col":9}},{"kind":"Type.Type","span":{"start":{"line":1,"col":10},"end":{"line":1,"col":25}},"children":[{"kind":"Type.Tuple","span":{"start":{"line":1,"col":10},"end":{"line":1,"col":25}},"children":[{"token":"ParenL","text":"(","start":{"line":1,"col":10},"end":{"line":1,"col":11}},{"kind":"Type.Type","span":{"start":{"line":1,"col":11},"end":{"line":1,"col":16}},"children":[{"kind":"QName","span":{"start":{"line":1,"col":11},"end":{"line":1,"col":16}},"children":[{"kind":"Ident","span":{"start":{"line":1,"col":11},"end":{"line":1,"col":16}},"children":[{"token":"NameUppercase","text":"Int32","start":{"line":1,"col":11},"end":{"line":1,"col":16}}]}]}]},{"token":"Comma","text":",","start":{"line":1,"col":16},"end":{"line":1,"col":17}},{"kind":"Type.Type","span":{"start":{"line":1,"col":18},"end":{"line":1,"col":24}},"children":[{"kind":"QName","span":{"start":{"line":1,"col":18},"end":{"line":1,"col":24}},"children":[{"kind":"Ident","span":{"start":{"line":1,"col":18},"end":{"line":1,"col":24}},"children":[{"token":"NameUppercase","text":"String","start":{"line":1,"col":18},"end":{"line":1,"col":24}}]}]}]},{"token":"ParenR","text":")","start":{"line":1,"col":24},"end":{"line":1,"col":25}}]}]},{"token":"Equal","text":"=","start":{"line":1,"col":26},"end":{"line":1,"col":27}},{"kind":"Expr.Expr","span":{"start":{"line":1,"col":28},"end":{"line":1,"col":31}},"children":[{"kind":"Expr.Hole","span":{"start":{"line":1,"col":28},"end":{"line":1,"col":31}},"children":[{"token":"HoleAnonymous","text":"???","start":{"line":1,"col":28},"end":{"line":1,"col":31}}]}]}]}]}
    }
  ]
}
