{
  "schemaVersion": 2,
  "generatedBy": "flix.spec.ProjectionExtractor",
  "toolVersion": "2.0.0",
  "form": "normalized",
  "upstreamCommit": "f2d4678c20bff1242f4cad5e23144db91027b762",
  "oracleSha256": "d8d9a3870e199c03ed6364ea9430f56f67bfd38c332c411628a6a7cb88b2b0b4",
  "units": [
    {
      "source": "fixtures/positive/expressions__array-literal-requires-a-region.flix",
      "diagnostics": [],
      "tree": {"kind":"Root","span":{"start":{"line":1,"col":1},"end":{"line":2,"col":1}},"children":[{"kind":"Decl.Def","span":{"start":{"line":1,"col":1},"end":{"line":1,"col":48}},"children":[{"token":"KeywordDef","text":"def","start":{"line":1,"col":1},"end":{"line":1,"col":4}},{"kind":"Ident","span":{"start":{"line":1,"col":5},"end":{"line":1,"col":6}},"children":[{"token":"NameLowercase","text":"f","start":{"line":1,"col":5},"end":{"line":1,"col":6}}]},{"kind":"ParameterList","span":{"start":{"line":1,"col":6},"end":{"line":1,"col":8}},"children":[{"token":"ParenL","text":"(","start":{"line":1,"col":6},"end":{"line":1,"col":7}},{"token":"ParenR","text":")","start":{"line":1,"col":7},"end":{"line":1,"col":8}}]},{"token":"Colon","text":":","start":{"line":1,"col":8},"end":{"line":1,"col":9}},{"kind":"Ident","span":{"start":{"line":1,"col":10},"end":{"line":1,"col":14}},"children":[{"token":"NameUppercase","text":"Unit","start":{"line":1,"col":10},"end":{"line":1,"col":14}}]},{"token":"Equal","text":"=","start":{"line":1,"col":15},"end":{"line":1,"col":16}},{"kind":"Expr.Region","span":{"start":{"line":1,"col":17},"end":{"line":1,"col":48}},"children":[{"token":"KeywordRegion","text":"region","start":{"line":1,"col":17},"end":{"line":1,"col":23}},{"kind":"Ident","span":{"start":{"line":1,"col":24},"end":{"line":1,"col":26}},"children":[{"token":"NameLowercase","text":"rc","start":{"line":1,"col":24},"end":{"line":1,"col":26}}]},{"kind":"Expr.Block","span":{"start":{"line":1,"col":27},"end":{"line":1,"col":48}},"children":[{"token":"CurlyL","text":"{","start":{"line":1,"col":27},"end":{"line":1,"col":28}},{"kind":"Expr.LiteralArray","span":{"start":{"line":1,"col":29},"end":{"line":1,"col":46}},"children":[{"token":"ArrayHash","text":"Array#","start":{"line":1,"col":29},"end":{"line":1,"col":35}},{"token":"CurlyL","text":"{","start":{"line":1,"col":35},"end":{"line":1,"col":36}},{"kind":"Expr.Literal","span":{"start":{"line":1,"col":36},"end":{"line":1,"col":37}},"children":[{"token":"LiteralInt","text":"1","start":{"line":1,"col":36},"end":{"line":1,"col":37}}]},{"token":"Comma","text":",","start":{"line":1,"col":37},"end":{"line":1,"col":38}},{"kind":"Expr.Literal","span":{"start":{"line":1,"col":39},"end":{"line":1,"col":40}},"children":[{"token":"LiteralInt","text":"2","start":{"line":1,"col":39},"end":{"line":1,"col":40}}]},{"token":"CurlyR","text":"}","start":{"line":1,"col":40},"end":{"line":1,"col":41}},{"kind":"Expr.RegionName","span":{"start":{"line":1,"col":42},"end":{"line":1,"col":46}},"children":[{"token":"At","text":"@","start":{"line":1,"col":42},"end":{"line":1,"col":43}},{"kind":"Ident","span":{"start":{"line":1,"col":44},"end":{"line":1,"col":46}},"children":[{"token":"NameLowercase","text":"rc","start":{"line":1,"col":44},"end":{"line":1,"col":46}}]}]}]},{"token":"CurlyR","text":"}","start":{"line":1,"col":47},"end":{"line":1,"col":48}}]}]}]}]}
    }
  ]
}
