{
  "schemaVersion": 2,
  "generatedBy": "flix.spec.ProjectionExtractor",
  "toolVersion": "2.0.0",
  "form": "normalized",
  "upstreamCommit": "f2d4678c20bff1242f4cad5e23144db91027b762",
  "oracleSha256": "d8d9a3870e199c03ed6364ea9430f56f67bfd38c332c411628a6a7cb88b2b0b4",
  "units": [
    {
      "source": "fixtures/positive/lexical__char-regex-and-escapes.flix",
      "diagnostics": [],
      "tree": {"kind":"Root","span":{"start":{"line":1,"col":1},"end":{"line":2,"col":1}},"children":[{"kind":"Decl.Def","span":{"start":{"line":1,"col":1},"end":{"line":1,"col":46}},"children":[{"token":"KeywordDef","text":"def","start":{"line":1,"col":1},"end":{"line":1,"col":4}},{"kind":"Ident","span":{"start":{"line":1,"col":5},"end":{"line":1,"col":6}},"children":[{"token":"NameLowercase","text":"f","start":{"line":1,"col":5},"end":{"line":1,"col":6}}]},{"kind":"ParameterList","span":{"start":{"line":1,"col":6},"end":{"line":1,"col":8}},"children":[{"token":"ParenL","text":"(","start":{"line":1,"col":6},"end":{"line":1,"col":7}},{"token":"ParenR","text":")","start":{"line":1,"col":7},"end":{"line":1,"col":8}}]},{"token":"Colon","text":":","start":{"line":1,"col":8},"end":{"line":1,"col":9}},{"kind":"Ident","span":{"start":{"line":1,"col":10},"end":{"line":1,"col":14}},"children":[{"token":"NameUppercase","text":"Unit","start":{"line":1,"col":10},"end":{"line":1,"col":14}}]},{"token":"Equal","text":"=","start":{"line":1,"col":15},"end":{"line":1,"col":16}},{"kind":"Expr.Tuple","span":{"start":{"line":1,"col":17},"end":{"line":1,"col":46}},"children":[{"token":"ParenL","text":"(","start":{"line":1,"col":17},"end":{"line":1,"col":18}},{"kind":"Expr.Literal","span":{"start":{"line":1,"col":18},"end":{"line":1,"col":21}},"children":[{"token":"LiteralChar","text":"'a'","start":{"line":1,"col":18},"end":{"line":1,"col":21}}]},{"token":"Comma","text":",","start":{"line":1,"col":21},"end":{"line":1,"col":22}},{"kind":"Expr.Literal","span":{"start":{"line":1,"col":23},"end":{"line":1,"col":27}},"children":[{"token":"LiteralChar","text":"'\\n'","start":{"line":1,"col":23},"end":{"line":1,"col":27}}]},{"token":"Comma","text":",","start":{"line":1,"col":27},"end":{"line":1,"col":28}},{"kind":"Expr.Literal","span":{"start":{"line":1,"col":29},"end":{"line":1,"col":32}},"children":[{"token":"LiteralChar","text":"'ÿ'","start":{"line":1,"col":29},"end":{"line":1,"col":32}}]},{"token":"Comma","text":",","start":{"line":1,"col":32},"end":{"line":1,"col":33}},{"kind":"Expr.Literal","span":{"start":{"line":1,"col":34},"end":{"line":1,"col":45}},"children":[{"token":"LiteralRegex","text":"regex\"\\\\d+\"","start":{"line":1,"col":34},"end":{"line":1,"col":45}}]},{"token":"ParenR","text":")","start":{"line":1,"col":45},"end":{"line":1,"col":46}}]}]}]}
    }
  ]
}
