{
  "schemaVersion": 2,
  "generatedBy": "flix.spec.ProjectionExtractor",
  "toolVersion": "2.0.0",
  "form": "normalized",
  "upstreamCommit": "4a5b60a31ac03bb762f68b554a0fc2b6f4d982b9",
  "oracleSha256": "20007d79f97b696ba388113e2a4235227691d33a00bfa669f2316b37a7b14201",
  "units": [
    {
      "source": "fixtures/positive/hello.flix",
      "diagnostics": [],
      "tree": {"kind":"Root","span":{"start":{"line":1,"col":1},"end":{"line":3,"col":1}},"children":[{"kind":"Decl.Def","span":{"start":{"line":1,"col":1},"end":{"line":2,"col":21}},"children":[{"token":"KeywordDef","text":"def","start":{"line":1,"col":1},"end":{"line":1,"col":4}},{"kind":"Ident","span":{"start":{"line":1,"col":5},"end":{"line":1,"col":9}},"children":[{"token":"NameLowercase","text":"main","start":{"line":1,"col":5},"end":{"line":1,"col":9}}]},{"kind":"ParameterList","span":{"start":{"line":1,"col":9},"end":{"line":1,"col":11}},"children":[{"token":"ParenL","text":"(","start":{"line":1,"col":9},"end":{"line":1,"col":10}},{"token":"ParenR","text":")","start":{"line":1,"col":10},"end":{"line":1,"col":11}}]},{"token":"Colon","text":":","start":{"line":1,"col":11},"end":{"line":1,"col":12}},{"kind":"Ident","span":{"start":{"line":1,"col":13},"end":{"line":1,"col":17}},"children":[{"token":"NameUppercase","text":"Unit","start":{"line":1,"col":13},"end":{"line":1,"col":17}}]},{"token":"Backslash","text":"\\","start":{"line":1,"col":18},"end":{"line":1,"col":19}},{"kind":"Ident","span":{"start":{"line":1,"col":20},"end":{"line":1,"col":22}},"children":[{"token":"NameUppercase","text":"IO","start":{"line":1,"col":20},"end":{"line":1,"col":22}}]},{"token":"Equal","text":"=","start":{"line":1,"col":23},"end":{"line":1,"col":24}},{"kind":"Expr.Apply","span":{"start":{"line":2,"col":5},"end":{"line":2,"col":21}},"children":[{"kind":"Ident","span":{"start":{"line":2,"col":5},"end":{"line":2,"col":12}},"children":[{"token":"NameLowercase","text":"println","start":{"line":2,"col":5},"end":{"line":2,"col":12}}]},{"kind":"ArgumentList","span":{"start":{"line":2,"col":12},"end":{"line":2,"col":21}},"children":[{"token":"ParenL","text":"(","start":{"line":2,"col":12},"end":{"line":2,"col":13}},{"kind":"Expr.Literal","span":{"start":{"line":2,"col":13},"end":{"line":2,"col":20}},"children":[{"token":"LiteralString","text":"\"hello\"","start":{"line":2,"col":13},"end":{"line":2,"col":20}}]},{"token":"ParenR","text":")","start":{"line":2,"col":20},"end":{"line":2,"col":21}}]}]}]}]}
    }
  ]
}
