{
  "schemaVersion": 2,
  "generatedBy": "flix.spec.ProjectionExtractor",
  "toolVersion": "2.0.0",
  "form": "normalized",
  "upstreamCommit": "4a5b60a31ac03bb762f68b554a0fc2b6f4d982b9",
  "oracleSha256": "20007d79f97b696ba388113e2a4235227691d33a00bfa669f2316b37a7b14201",
  "units": [
    {
      "source": "fixtures/positive/lexical__bang-and-dollar-are-name-characters.flix",
      "diagnostics": [],
      "tree": {"kind":"Root","span":{"start":{"line":1,"col":1},"end":{"line":2,"col":1}},"children":[{"kind":"Decl.Def","span":{"start":{"line":1,"col":1},"end":{"line":1,"col":26}},"children":[{"token":"KeywordDef","text":"def","start":{"line":1,"col":1},"end":{"line":1,"col":4}},{"kind":"Ident","span":{"start":{"line":1,"col":5},"end":{"line":1,"col":6}},"children":[{"token":"NameLowercase","text":"f","start":{"line":1,"col":5},"end":{"line":1,"col":6}}]},{"kind":"ParameterList","span":{"start":{"line":1,"col":6},"end":{"line":1,"col":8}},"children":[{"token":"ParenL","text":"(","start":{"line":1,"col":6},"end":{"line":1,"col":7}},{"token":"ParenR","text":")","start":{"line":1,"col":7},"end":{"line":1,"col":8}}]},{"token":"Colon","text":":","start":{"line":1,"col":8},"end":{"line":1,"col":9}},{"kind":"Ident","span":{"start":{"line":1,"col":10},"end":{"line":1,"col":14}},"children":[{"token":"NameUppercase","text":"Unit","start":{"line":1,"col":10},"end":{"line":1,"col":14}}]},{"token":"Equal","text":"=","start":{"line":1,"col":15},"end":{"line":1,"col":16}},{"kind":"Expr.Tuple","span":{"start":{"line":1,"col":17},"end":{"line":1,"col":26}},"children":[{"token":"ParenL","text":"(","start":{"line":1,"col":17},"end":{"line":1,"col":18}},{"kind":"Ident","span":{"start":{"line":1,"col":18},"end":{"line":1,"col":20}},"children":[{"token":"NameLowercase","text":"a!","start":{"line":1,"col":18},"end":{"line":1,"col":20}}]},{"token":"Comma","text":",","start":{"line":1,"col":20},"end":{"line":1,"col":21}},{"kind":"Ident","span":{"start":{"line":1,"col":22},"end":{"line":1,"col":25}},"children":[{"token":"NameLowercase","text":"b$c","start":{"line":1,"col":22},"end":{"line":1,"col":25}}]},{"token":"ParenR","text":")","start":{"line":1,"col":25},"end":{"line":1,"col":26}}]}]}]}
    }
  ]
}
