{
  "schemaVersion": 2,
  "generatedBy": "flix.spec.ProjectionExtractor",
  "toolVersion": "2.0.0",
  "form": "raw",
  "upstreamCommit": "4a5b60a31ac03bb762f68b554a0fc2b6f4d982b9",
  "oracleSha256": "20007d79f97b696ba388113e2a4235227691d33a00bfa669f2316b37a7b14201",
  "units": [
    {
      "source": "fixtures/positive/declarations__struct.flix",
      "diagnostics": [],
      "tree": {"kind":"Root","span":{"start":{"line":1,"col":1},"end":{"line":5,"col":1}},"children":[{"kind":"UsesOrImports.UseOrImportList","span":{"start":{"line":1,"col":1},"end":{"line":1,"col":1}},"children":[]},{"kind":"Decl.Struct","span":{"start":{"line":1,"col":1},"end":{"line":4,"col":2}},"children":[{"kind":"Doc","span":{"start":{"line":1,"col":1},"end":{"line":1,"col":1}},"children":[]},{"kind":"AnnotationList","span":{"start":{"line":1,"col":1},"end":{"line":1,"col":1}},"children":[]},{"kind":"ModifierList","span":{"start":{"line":1,"col":1},"end":{"line":1,"col":1}},"children":[]},{"token":"KeywordStruct","text":"struct","start":{"line":1,"col":1},"end":{"line":1,"col":7}},{"kind":"Ident","span":{"start":{"line":1,"col":8},"end":{"line":1,"col":12}},"children":[{"token":"NameUppercase","text":"Node","start":{"line":1,"col":8},"end":{"line":1,"col":12}}]},{"kind":"TypeParameterList","span":{"start":{"line":1,"col":12},"end":{"line":1,"col":18}},"children":[{"token":"BracketL","text":"[","start":{"line":1,"col":12},"end":{"line":1,"col":13}},{"kind":"Parameter","span":{"start":{"line":1,"col":13},"end":{"line":1,"col":14}},"children":[{"kind":"Ident","span":{"start":{"line":1,"col":13},"end":{"line":1,"col":14}},"children":[{"token":"NameLowercase","text":"t","start":{"line":1,"col":13},"end":{"line":1,"col":14}}]}]},{"token":"Comma","text":",","start":{"line":1,"col":14},"end":{"line":1,"col":15}},{"kind":"Parameter","span":{"start":{"line":1,"col":16},"end":{"line":1,"col":17}},"children":[{"kind":"Ident","span":{"start":{"line":1,"col":16},"end":{"line":1,"col":17}},"children":[{"token":"NameLowercase","text":"r","start":{"line":1,"col":16},"end":{"line":1,"col":17}}]}]},{"token":"BracketR","text":"]","start":{"line":1,"col":17},"end":{"line":1,"col":18}}]},{"token":"CurlyL","text":"{","start":{"line":1,"col":19},"end":{"line":1,"col":20}},{"kind":"StructField","span":{"start":{"line":2,"col":5},"end":{"line":2,"col":17}},"children":[{"kind":"Doc","span":{"start":{"line":1,"col":20},"end":{"line":1,"col":20}},"children":[]},{"kind":"ModifierList","span":{"start":{"line":2,"col":5},"end":{"line":2,"col":8}},"children":[{"token":"KeywordMut","text":"mut","start":{"line":2,"col":5},"end":{"line":2,"col":8}}]},{"kind":"Ident","span":{"start":{"line":2,"col":9},"end":{"line":2,"col":14}},"children":[{"token":"NameLowercase","text":"value","start":{"line":2,"col":9},"end":{"line":2,"col":14}}]},{"token":"Colon","text":":","start":{"line":2,"col":14},"end":{"line":2,"col":15}},{"kind":"Type.Type","span":{"start":{"line":2,"col":16},"end":{"line":2,"col":17}},"children":[{"kind":"Type.Variable","span":{"start":{"line":2,"col":16},"end":{"line":2,"col":17}},"children":[{"token":"NameLowercase","text":"t","start":{"line":2,"col":16},"end":{"line":2,"col":17}}]}]}]},{"token":"Comma","text":",","start":{"line":2,"col":17},"end":{"line":2,"col":18}},{"kind":"StructField","span":{"start":{"line":3,"col":5},"end":{"line":3,"col":21}},"children":[{"kind":"Doc","span":{"start":{"line":2,"col":18},"end":{"line":2,"col":18}},"children":[]},{"kind":"ModifierList","span":{"start":{"line":2,"col":18},"end":{"line":2,"col":18}},"children":[]},{"kind":"Ident","span":{"start":{"line":3,"col":5},"end":{"line":3,"col":9}},"children":[{"token":"NameLowercase","text":"next","start":{"line":3,"col":5},"end":{"line":3,"col":9}}]},{"token":"Colon","text":":","start":{"line":3,"col":9},"end":{"line":3,"col":10}},{"kind":"Type.Type","span":{"start":{"line":3,"col":11},"end":{"line":3,"col":21}},"children":[{"kind":"Type.Apply","span":{"start":{"line":3,"col":11},"end":{"line":3,"col":21}},"children":[{"kind":"Type.Type","span":{"start":{"line":3,"col":11},"end":{"line":3,"col":15}},"children":[{"kind":"QName","span":{"start":{"line":3,"col":11},"end":{"line":3,"col":15}},"children":[{"kind":"Ident","span":{"start":{"line":3,"col":11},"end":{"line":3,"col":15}},"children":[{"token":"NameUppercase","text":"Node","start":{"line":3,"col":11},"end":{"line":3,"col":15}}]}]}]},{"kind":"Type.ArgumentList","span":{"start":{"line":3,"col":15},"end":{"line":3,"col":21}},"children":[{"token":"BracketL","text":"[","start":{"line":3,"col":15},"end":{"line":3,"col":16}},{"kind":"Type.Argument","span":{"start":{"line":3,"col":16},"end":{"line":3,"col":17}},"children":[{"kind":"Type.Type","span":{"start":{"line":3,"col":16},"end":{"line":3,"col":17}},"children":[{"kind":"Type.Variable","span":{"start":{"line":3,"col":16},"end":{"line":3,"col":17}},"children":[{"token":"NameLowercase","text":"t","start":{"line":3,"col":16},"end":{"line":3,"col":17}}]}]}]},{"token":"Comma","text":",","start":{"line":3,"col":17},"end":{"line":3,"col":18}},{"kind":"Type.Argument","span":{"start":{"line":3,"col":19},"end":{"line":3,"col":20}},"children":[{"kind":"Type.Type","span":{"start":{"line":3,"col":19},"end":{"line":3,"col":20}},"children":[{"kind":"Type.Variable","span":{"start":{"line":3,"col":19},"end":{"line":3,"col":20}},"children":[{"token":"NameLowercase","text":"r","start":{"line":3,"col":19},"end":{"line":3,"col":20}}]}]}]},{"token":"BracketR","text":"]","start":{"line":3,"col":20},"end":{"line":3,"col":21}}]}]}]}]},{"token":"CurlyR","text":"}","start":{"line":4,"col":1},"end":{"line":4,"col":2}}]}]}
    }
  ]
}
