{
  "schemaVersion": 2,
  "generatedBy": "flix.spec.ProjectionExtractor",
  "toolVersion": "2.0.0",
  "form": "raw",
  "upstreamCommit": "4a5b60a31ac03bb762f68b554a0fc2b6f4d982b9",
  "oracleSha256": "20007d79f97b696ba388113e2a4235227691d33a00bfa669f2316b37a7b14201",
  "units": [
    {
      "source": "fixtures/positive/expressions__struct-literal-with-field-initialisers.flix",
      "diagnostics": [],
      "tree": {"kind":"Root","span":{"start":{"line":1,"col":1},"end":{"line":2,"col":1}},"children":[{"kind":"UsesOrImports.UseOrImportList","span":{"start":{"line":1,"col":1},"end":{"line":1,"col":1}},"children":[]},{"kind":"Decl.Def","span":{"start":{"line":1,"col":1},"end":{"line":1,"col":71}},"children":[{"kind":"Doc","span":{"start":{"line":1,"col":1},"end":{"line":1,"col":1}},"children":[]},{"kind":"AnnotationList","span":{"start":{"line":1,"col":1},"end":{"line":1,"col":1}},"children":[]},{"kind":"ModifierList","span":{"start":{"line":1,"col":1},"end":{"line":1,"col":1}},"children":[]},{"token":"KeywordDef","text":"def","start":{"line":1,"col":1},"end":{"line":1,"col":4}},{"kind":"Ident","span":{"start":{"line":1,"col":5},"end":{"line":1,"col":6}},"children":[{"token":"NameLowercase","text":"f","start":{"line":1,"col":5},"end":{"line":1,"col":6}}]},{"kind":"ParameterList","span":{"start":{"line":1,"col":6},"end":{"line":1,"col":8}},"children":[{"token":"ParenL","text":"(","start":{"line":1,"col":6},"end":{"line":1,"col":7}},{"token":"ParenR","text":")","start":{"line":1,"col":7},"end":{"line":1,"col":8}}]},{"token":"Colon","text":":","start":{"line":1,"col":8},"end":{"line":1,"col":9}},{"kind":"Type.Type","span":{"start":{"line":1,"col":10},"end":{"line":1,"col":14}},"children":[{"kind":"QName","span":{"start":{"line":1,"col":10},"end":{"line":1,"col":14}},"children":[{"kind":"Ident","span":{"start":{"line":1,"col":10},"end":{"line":1,"col":14}},"children":[{"token":"NameUppercase","text":"Unit","start":{"line":1,"col":10},"end":{"line":1,"col":14}}]}]}]},{"token":"Equal","text":"=","start":{"line":1,"col":15},"end":{"line":1,"col":16}},{"kind":"Expr.Expr","span":{"start":{"line":1,"col":17},"end":{"line":1,"col":71}},"children":[{"kind":"Expr.Region","span":{"start":{"line":1,"col":17},"end":{"line":1,"col":71}},"children":[{"token":"KeywordRegion","text":"region","start":{"line":1,"col":17},"end":{"line":1,"col":23}},{"kind":"Ident","span":{"start":{"line":1,"col":24},"end":{"line":1,"col":26}},"children":[{"token":"NameLowercase","text":"rc","start":{"line":1,"col":24},"end":{"line":1,"col":26}}]},{"kind":"Expr.Block","span":{"start":{"line":1,"col":27},"end":{"line":1,"col":71}},"children":[{"token":"CurlyL","text":"{","start":{"line":1,"col":27},"end":{"line":1,"col":28}},{"kind":"Expr.Expr","span":{"start":{"line":1,"col":29},"end":{"line":1,"col":69}},"children":[{"kind":"Expr.AmbiguousNew","span":{"start":{"line":1,"col":29},"end":{"line":1,"col":69}},"children":[{"token":"KeywordNew","text":"new","start":{"line":1,"col":29},"end":{"line":1,"col":32}},{"kind":"Type.Type","span":{"start":{"line":1,"col":33},"end":{"line":1,"col":40}},"children":[{"kind":"QName","span":{"start":{"line":1,"col":33},"end":{"line":1,"col":40}},"children":[{"kind":"Ident","span":{"start":{"line":1,"col":33},"end":{"line":1,"col":40}},"children":[{"token":"NameUppercase","text":"Counter","start":{"line":1,"col":33},"end":{"line":1,"col":40}}]}]}]},{"token":"At","text":"@","start":{"line":1,"col":41},"end":{"line":1,"col":42}},{"kind":"Expr.Expr","span":{"start":{"line":1,"col":43},"end":{"line":1,"col":45}},"children":[{"kind":"QName","span":{"start":{"line":1,"col":43},"end":{"line":1,"col":45}},"children":[{"kind":"Ident","span":{"start":{"line":1,"col":43},"end":{"line":1,"col":45}},"children":[{"token":"NameLowercase","text":"rc","start":{"line":1,"col":43},"end":{"line":1,"col":45}}]}]}]},{"token":"CurlyL","text":"{","start":{"line":1,"col":46},"end":{"line":1,"col":47}},{"kind":"Expr.LiteralStructFieldFragment","span":{"start":{"line":1,"col":48},"end":{"line":1,"col":57}},"children":[{"kind":"Ident","span":{"start":{"line":1,"col":48},"end":{"line":1,"col":53}},"children":[{"token":"NameLowercase","text":"count","start":{"line":1,"col":48},"end":{"line":1,"col":53}}]},{"token":"Equal","text":"=","start":{"line":1,"col":54},"end":{"line":1,"col":55}},{"kind":"Expr.Expr","span":{"start":{"line":1,"col":56},"end":{"line":1,"col":57}},"children":[{"kind":"Expr.Literal","span":{"start":{"line":1,"col":56},"end":{"line":1,"col":57}},"children":[{"token":"LiteralInt","text":"0","start":{"line":1,"col":56},"end":{"line":1,"col":57}}]}]}]},{"token":"Comma","text":",","start":{"line":1,"col":57},"end":{"line":1,"col":58}},{"kind":"Expr.LiteralStructFieldFragment","span":{"start":{"line":1,"col":59},"end":{"line":1,"col":67}},"children":[{"kind":"Ident","span":{"start":{"line":1,"col":59},"end":{"line":1,"col":63}},"children":[{"token":"NameLowercase","text":"step","start":{"line":1,"col":59},"end":{"line":1,"col":63}}]},{"token":"Equal","text":"=","start":{"line":1,"col":64},"end":{"line":1,"col":65}},{"kind":"Expr.Expr","span":{"start":{"line":1,"col":66},"end":{"line":1,"col":67}},"children":[{"kind":"Expr.Literal","span":{"start":{"line":1,"col":66},"end":{"line":1,"col":67}},"children":[{"token":"LiteralInt","text":"1","start":{"line":1,"col":66},"end":{"line":1,"col":67}}]}]}]},{"token":"CurlyR","text":"}","start":{"line":1,"col":68},"end":{"line":1,"col":69}}]}]},{"token":"CurlyR","text":"}","start":{"line":1,"col":70},"end":{"line":1,"col":71}}]}]}]}]}]}
    }
  ]
}
