{
  "schemaVersion": 2,
  "generatedBy": "flix.spec.ProjectionExtractor",
  "toolVersion": "2.0.0",
  "form": "raw",
  "upstreamCommit": "4a5b60a31ac03bb762f68b554a0fc2b6f4d982b9",
  "oracleSha256": "20007d79f97b696ba388113e2a4235227691d33a00bfa669f2316b37a7b14201",
  "units": [
    {
      "source": "fixtures/positive/datalog__query-with-a-where-clause.flix",
      "diagnostics": [],
      "tree": {"kind":"Root","span":{"start":{"line":1,"col":1},"end":{"line":2,"col":1}},"children":[{"kind":"UsesOrImports.UseOrImportList","span":{"start":{"line":1,"col":1},"end":{"line":1,"col":1}},"children":[]},{"kind":"Decl.Def","span":{"start":{"line":1,"col":1},"end":{"line":1,"col":67}},"children":[{"kind":"Doc","span":{"start":{"line":1,"col":1},"end":{"line":1,"col":1}},"children":[]},{"kind":"AnnotationList","span":{"start":{"line":1,"col":1},"end":{"line":1,"col":1}},"children":[]},{"kind":"ModifierList","span":{"start":{"line":1,"col":1},"end":{"line":1,"col":1}},"children":[]},{"token":"KeywordDef","text":"def","start":{"line":1,"col":1},"end":{"line":1,"col":4}},{"kind":"Ident","span":{"start":{"line":1,"col":5},"end":{"line":1,"col":6}},"children":[{"token":"NameLowercase","text":"f","start":{"line":1,"col":5},"end":{"line":1,"col":6}}]},{"kind":"ParameterList","span":{"start":{"line":1,"col":6},"end":{"line":1,"col":8}},"children":[{"token":"ParenL","text":"(","start":{"line":1,"col":6},"end":{"line":1,"col":7}},{"token":"ParenR","text":")","start":{"line":1,"col":7},"end":{"line":1,"col":8}}]},{"token":"Colon","text":":","start":{"line":1,"col":8},"end":{"line":1,"col":9}},{"kind":"Type.Type","span":{"start":{"line":1,"col":10},"end":{"line":1,"col":14}},"children":[{"kind":"QName","span":{"start":{"line":1,"col":10},"end":{"line":1,"col":14}},"children":[{"kind":"Ident","span":{"start":{"line":1,"col":10},"end":{"line":1,"col":14}},"children":[{"token":"NameUppercase","text":"Unit","start":{"line":1,"col":10},"end":{"line":1,"col":14}}]}]}]},{"token":"Equal","text":"=","start":{"line":1,"col":15},"end":{"line":1,"col":16}},{"kind":"Expr.Expr","span":{"start":{"line":1,"col":17},"end":{"line":1,"col":67}},"children":[{"kind":"Expr.FixpointQuery","span":{"start":{"line":1,"col":17},"end":{"line":1,"col":67}},"children":[{"token":"KeywordQuery","text":"query","start":{"line":1,"col":17},"end":{"line":1,"col":22}},{"kind":"Expr.Expr","span":{"start":{"line":1,"col":23},"end":{"line":1,"col":25}},"children":[{"kind":"QName","span":{"start":{"line":1,"col":23},"end":{"line":1,"col":25}},"children":[{"kind":"Ident","span":{"start":{"line":1,"col":23},"end":{"line":1,"col":25}},"children":[{"token":"NameLowercase","text":"db","start":{"line":1,"col":23},"end":{"line":1,"col":25}}]}]}]},{"kind":"Expr.FixpointSelect","span":{"start":{"line":1,"col":26},"end":{"line":1,"col":39}},"children":[{"token":"KeywordSelect","text":"select","start":{"line":1,"col":26},"end":{"line":1,"col":32}},{"token":"ParenL","text":"(","start":{"line":1,"col":33},"end":{"line":1,"col":34}},{"kind":"Expr.Expr","span":{"start":{"line":1,"col":34},"end":{"line":1,"col":35}},"children":[{"kind":"QName","span":{"start":{"line":1,"col":34},"end":{"line":1,"col":35}},"children":[{"kind":"Ident","span":{"start":{"line":1,"col":34},"end":{"line":1,"col":35}},"children":[{"token":"NameLowercase","text":"x","start":{"line":1,"col":34},"end":{"line":1,"col":35}}]}]}]},{"token":"Comma","text":",","start":{"line":1,"col":35},"end":{"line":1,"col":36}},{"kind":"Expr.Expr","span":{"start":{"line":1,"col":37},"end":{"line":1,"col":38}},"children":[{"kind":"QName","span":{"start":{"line":1,"col":37},"end":{"line":1,"col":38}},"children":[{"kind":"Ident","span":{"start":{"line":1,"col":37},"end":{"line":1,"col":38}},"children":[{"token":"NameLowercase","text":"y","start":{"line":1,"col":37},"end":{"line":1,"col":38}}]}]}]},{"token":"ParenR","text":")","start":{"line":1,"col":38},"end":{"line":1,"col":39}}]},{"kind":"Expr.FixpointFromFragment","span":{"start":{"line":1,"col":40},"end":{"line":1,"col":55}},"children":[{"token":"KeywordFrom","text":"from","start":{"line":1,"col":40},"end":{"line":1,"col":44}},{"kind":"Predicate.Atom","span":{"start":{"line":1,"col":45},"end":{"line":1,"col":55}},"children":[{"kind":"Ident","span":{"start":{"line":1,"col":45},"end":{"line":1,"col":49}},"children":[{"token":"NameUppercase","text":"Edge","start":{"line":1,"col":45},"end":{"line":1,"col":49}}]},{"kind":"Predicate.PatternList","span":{"start":{"line":1,"col":49},"end":{"line":1,"col":55}},"children":[{"token":"ParenL","text":"(","start":{"line":1,"col":49},"end":{"line":1,"col":50}},{"kind":"Pattern.Pattern","span":{"start":{"line":1,"col":50},"end":{"line":1,"col":51}},"children":[{"kind":"Pattern.Variable","span":{"start":{"line":1,"col":50},"end":{"line":1,"col":51}},"children":[{"kind":"Ident","span":{"start":{"line":1,"col":50},"end":{"line":1,"col":51}},"children":[{"token":"NameLowercase","text":"x","start":{"line":1,"col":50},"end":{"line":1,"col":51}}]}]}]},{"token":"Comma","text":",","start":{"line":1,"col":51},"end":{"line":1,"col":52}},{"kind":"Pattern.Pattern","span":{"start":{"line":1,"col":53},"end":{"line":1,"col":54}},"children":[{"kind":"Pattern.Variable","span":{"start":{"line":1,"col":53},"end":{"line":1,"col":54}},"children":[{"kind":"Ident","span":{"start":{"line":1,"col":53},"end":{"line":1,"col":54}},"children":[{"token":"NameLowercase","text":"y","start":{"line":1,"col":53},"end":{"line":1,"col":54}}]}]}]},{"token":"ParenR","text":")","start":{"line":1,"col":54},"end":{"line":1,"col":55}}]}]}]},{"kind":"Expr.FixpointWhere","span":{"start":{"line":1,"col":56},"end":{"line":1,"col":67}},"children":[{"token":"KeywordWhere","text":"where","start":{"line":1,"col":56},"end":{"line":1,"col":61}},{"kind":"Expr.Expr","span":{"start":{"line":1,"col":62},"end":{"line":1,"col":67}},"children":[{"kind":"Expr.Binary","span":{"start":{"line":1,"col":62},"end":{"line":1,"col":67}},"children":[{"kind":"Expr.Expr","span":{"start":{"line":1,"col":62},"end":{"line":1,"col":63}},"children":[{"kind":"QName","span":{"start":{"line":1,"col":62},"end":{"line":1,"col":63}},"children":[{"kind":"Ident","span":{"start":{"line":1,"col":62},"end":{"line":1,"col":63}},"children":[{"token":"NameLowercase","text":"x","start":{"line":1,"col":62},"end":{"line":1,"col":63}}]}]}]},{"kind":"Operator","span":{"start":{"line":1,"col":64},"end":{"line":1,"col":65}},"children":[{"token":"AngleL","text":"<","start":{"line":1,"col":64},"end":{"line":1,"col":65}}]},{"kind":"Expr.Expr","span":{"start":{"line":1,"col":66},"end":{"line":1,"col":67}},"children":[{"kind":"QName","span":{"start":{"line":1,"col":66},"end":{"line":1,"col":67}},"children":[{"kind":"Ident","span":{"start":{"line":1,"col":66},"end":{"line":1,"col":67}},"children":[{"token":"NameLowercase","text":"y","start":{"line":1,"col":66},"end":{"line":1,"col":67}}]}]}]}]}]}]}]}]}]}]}
    }
  ]
}
