{
  "schemaVersion": 2,
  "generatedBy": "flix.spec.ProjectionExtractor",
  "toolVersion": "2.0.0",
  "form": "normalized",
  "upstreamCommit": "f2d4678c20bff1242f4cad5e23144db91027b762",
  "oracleSha256": "d8d9a3870e199c03ed6364ea9430f56f67bfd38c332c411628a6a7cb88b2b0b4",
  "units": [
    {
      "source": "fixtures/positive/expressions__cons-and-literal-patterns.flix",
      "diagnostics": [],
      "tree": {"kind":"Root","span":{"start":{"line":1,"col":1},"end":{"line":6,"col":1}},"children":[{"kind":"Decl.Def","span":{"start":{"line":1,"col":1},"end":{"line":5,"col":2}},"children":[{"token":"KeywordDef","text":"def","start":{"line":1,"col":1},"end":{"line":1,"col":4}},{"kind":"Ident","span":{"start":{"line":1,"col":5},"end":{"line":1,"col":6}},"children":[{"token":"NameLowercase","text":"f","start":{"line":1,"col":5},"end":{"line":1,"col":6}}]},{"kind":"ParameterList","span":{"start":{"line":1,"col":6},"end":{"line":1,"col":8}},"children":[{"token":"ParenL","text":"(","start":{"line":1,"col":6},"end":{"line":1,"col":7}},{"token":"ParenR","text":")","start":{"line":1,"col":7},"end":{"line":1,"col":8}}]},{"token":"Colon","text":":","start":{"line":1,"col":8},"end":{"line":1,"col":9}},{"kind":"Ident","span":{"start":{"line":1,"col":10},"end":{"line":1,"col":15}},"children":[{"token":"NameUppercase","text":"Int32","start":{"line":1,"col":10},"end":{"line":1,"col":15}}]},{"token":"Equal","text":"=","start":{"line":1,"col":16},"end":{"line":1,"col":17}},{"kind":"Expr.Match","span":{"start":{"line":1,"col":18},"end":{"line":5,"col":2}},"children":[{"token":"KeywordMatch","text":"match","start":{"line":1,"col":18},"end":{"line":1,"col":23}},{"kind":"Ident","span":{"start":{"line":1,"col":24},"end":{"line":1,"col":26}},"children":[{"token":"NameLowercase","text":"xs","start":{"line":1,"col":24},"end":{"line":1,"col":26}}]},{"token":"CurlyL","text":"{","start":{"line":1,"col":27},"end":{"line":1,"col":28}},{"kind":"Expr.MatchRuleFragment","span":{"start":{"line":2,"col":5},"end":{"line":2,"col":24}},"children":[{"token":"KeywordCase","text":"case","start":{"line":2,"col":5},"end":{"line":2,"col":9}},{"kind":"Pattern.FCons","span":{"start":{"line":2,"col":10},"end":{"line":2,"col":19}},"children":[{"kind":"Pattern.Pattern","span":{"start":{"line":2,"col":10},"end":{"line":2,"col":14}},"children":[{"kind":"Pattern.Literal","span":{"start":{"line":2,"col":10},"end":{"line":2,"col":11}},"children":[{"token":"LiteralInt","text":"1","start":{"line":2,"col":10},"end":{"line":2,"col":11}}]},{"token":"ColonColon","text":"::","start":{"line":2,"col":12},"end":{"line":2,"col":14}}]},{"kind":"Ident","span":{"start":{"line":2,"col":15},"end":{"line":2,"col":19}},"children":[{"token":"NameLowercase","text":"rest","start":{"line":2,"col":15},"end":{"line":2,"col":19}}]}]},{"token":"ArrowThickR","text":"=>","start":{"line":2,"col":20},"end":{"line":2,"col":22}},{"kind":"Expr.Literal","span":{"start":{"line":2,"col":23},"end":{"line":2,"col":24}},"children":[{"token":"LiteralInt","text":"1","start":{"line":2,"col":23},"end":{"line":2,"col":24}}]}]},{"kind":"Expr.MatchRuleFragment","span":{"start":{"line":3,"col":5},"end":{"line":3,"col":25}},"children":[{"token":"KeywordCase","text":"case","start":{"line":3,"col":5},"end":{"line":3,"col":9}},{"kind":"Pattern.FCons","span":{"start":{"line":3,"col":10},"end":{"line":3,"col":20}},"children":[{"kind":"Pattern.Pattern","span":{"start":{"line":3,"col":10},"end":{"line":3,"col":15}},"children":[{"kind":"Pattern.Unary","span":{"start":{"line":3,"col":10},"end":{"line":3,"col":12}},"children":[{"kind":"Operator","span":{"start":{"line":3,"col":10},"end":{"line":3,"col":11}},"children":[{"token":"Minus","text":"-","start":{"line":3,"col":10},"end":{"line":3,"col":11}}]},{"token":"LiteralInt","text":"2","start":{"line":3,"col":11},"end":{"line":3,"col":12}}]},{"token":"ColonColon","text":"::","start":{"line":3,"col":13},"end":{"line":3,"col":15}}]},{"kind":"Ident","span":{"start":{"line":3,"col":16},"end":{"line":3,"col":20}},"children":[{"token":"NameLowercase","text":"rest","start":{"line":3,"col":16},"end":{"line":3,"col":20}}]}]},{"token":"ArrowThickR","text":"=>","start":{"line":3,"col":21},"end":{"line":3,"col":23}},{"kind":"Expr.Literal","span":{"start":{"line":3,"col":24},"end":{"line":3,"col":25}},"children":[{"token":"LiteralInt","text":"2","start":{"line":3,"col":24},"end":{"line":3,"col":25}}]}]},{"kind":"Expr.MatchRuleFragment","span":{"start":{"line":4,"col":5},"end":{"line":4,"col":18}},"children":[{"token":"KeywordCase","text":"case","start":{"line":4,"col":5},"end":{"line":4,"col":9}},{"kind":"Pattern.Tag","span":{"start":{"line":4,"col":10},"end":{"line":4,"col":13}},"children":[{"kind":"Ident","span":{"start":{"line":4,"col":10},"end":{"line":4,"col":13}},"children":[{"token":"NameUppercase","text":"Nil","start":{"line":4,"col":10},"end":{"line":4,"col":13}}]}]},{"token":"ArrowThickR","text":"=>","start":{"line":4,"col":14},"end":{"line":4,"col":16}},{"kind":"Expr.Literal","span":{"start":{"line":4,"col":17},"end":{"line":4,"col":18}},"children":[{"token":"LiteralInt","text":"0","start":{"line":4,"col":17},"end":{"line":4,"col":18}}]}]},{"token":"CurlyR","text":"}","start":{"line":5,"col":1},"end":{"line":5,"col":2}}]}]}]}
    }
  ]
}
